{"admissible":false,"arms":[{"activation_contract":"entry-points-unmanaged","activation_probe_observation":{"command":{"argument_files":[{"index":0,"path":"/root/ecpa-h1-e583-stock-venv/bin/ecpa-host-launch","sha256":"sha256:861f968816eb6b4b7c2c0490cca8ece363448532eebf8ad26898342c002ea4f1"}],"arguments":["/root/ecpa-h1-e583-stock-venv/bin/ecpa-host-launch","serve","/models/Qwen2.5-7B-Instruct","--served-model-name","ecpa-h1","--host","127.0.0.1","--port","8187","--tensor-parallel-size","2","--enforce-eager","--max-model-len","2048","--gpu-memory-utilization","0.7","--shutdown-timeout","20","--disable-ecpa-manager","--enable-entrypoints","--ecpa-formal-activation-probe"],"digest":"sha256:9cc09fe8c736a8081a3b1e4b0346a8c2b2d36e91acb55cc47e9b63970a102678","executable":"/root/ecpa-h1-e583-stock-venv/bin/python","executable_device":2097167,"executable_inode":77098091,"executable_resolved":"/usr/local/python3.12.13/bin/python3.12","executable_sha256":"sha256:5d137e6378d886d6ee0390e126011e9e8af81290032e3fefa13a81f72651fda0"},"exit_code":0,"output_sha256":"sha256:9d5a0601d3acfcd1df0bcf8af4d97b73c51b270ca5e26c5fdaac1a19a1ac1f45","receipt":{"accepted_options":["--disable-ecpa-manager","--enable-entrypoints"],"activation_contract":"entry-points-unmanaged","schema":"ecpa-activation-probe/v1"},"required_options":["--disable-ecpa-manager","--enable-entrypoints"],"stderr_base64":"","stdout_base64":"eyJhY2NlcHRlZF9vcHRpb25zIjpbIi0tZGlzYWJsZS1lY3BhLW1hbmFnZXIiLCItLWVuYWJsZS1lbnRyeXBvaW50cyJdLCJhY3RpdmF0aW9uX2NvbnRyYWN0IjoiZW50cnktcG9pbnRzLXVubWFuYWdlZCIsInNjaGVtYSI6ImVjcGEtYWN0aXZhdGlvbi1wcm9iZS92MSJ9Cg=="},"arm":"vanilla-vllm-entry-points","commands":{"activation_probe":{"argument_files":[{"index":0,"path":"/root/ecpa-h1-e583-stock-venv/bin/ecpa-host-launch","sha256":"sha256:861f968816eb6b4b7c2c0490cca8ece363448532eebf8ad26898342c002ea4f1"}],"arguments":["/root/ecpa-h1-e583-stock-venv/bin/ecpa-host-launch","serve","/models/Qwen2.5-7B-Instruct","--served-model-name","ecpa-h1","--host","127.0.0.1","--port","8187","--tensor-parallel-size","2","--enforce-eager","--max-model-len","2048","--gpu-memory-utilization","0.7","--shutdown-timeout","20","--disable-ecpa-manager","--enable-entrypoints","--ecpa-formal-activation-probe"],"digest":"sha256:9cc09fe8c736a8081a3b1e4b0346a8c2b2d36e91acb55cc47e9b63970a102678","executable":"/root/ecpa-h1-e583-stock-venv/bin/python","executable_device":2097167,"executable_inode":77098091,"executable_resolved":"/usr/local/python3.12.13/bin/python3.12","executable_sha256":"sha256:5d137e6378d886d6ee0390e126011e9e8af81290032e3fefa13a81f72651fda0"},"observer":{"argument_files":[{"index":0,"path":"/root/ecpa-h1-e583-stock-venv/bin/ecpa-formal-observer","sha256":"sha256:f52209045281b456f9e5a9ff6f20e87410cc572802f59edfc2813e2785d26ed0"}],"arguments":["/root/ecpa-h1-e583-stock-venv/bin/ecpa-formal-observer","--event-dir","/root/ecpa-h1-e583-registration-workspace/shared/events","--device","2128","--inode","14811151","--entry-point-group","vllm.general_plugins","--entry-point-name","kv_materialization","--entry-point-value","vllm_kv_materialization.plugin:register_plugin"],"digest":"sha256:bd9fa7fa495893098f315abfd7fe1c1d35f9a4cc22c9039f40bb1a6e4e9bc365","executable":"/root/ecpa-h1-e583-stock-venv/bin/python","executable_device":2097167,"executable_inode":77098091,"executable_resolved":"/usr/local/python3.12.13/bin/python3.12","executable_sha256":"sha256:5d137e6378d886d6ee0390e126011e9e8af81290032e3fefa13a81f72651fda0"},"sut":{"argument_files":[{"index":0,"path":"/root/ecpa-h1-e583-stock-venv/bin/ecpa-host-launch","sha256":"sha256:861f968816eb6b4b7c2c0490cca8ece363448532eebf8ad26898342c002ea4f1"}],"arguments":["/root/ecpa-h1-e583-stock-venv/bin/ecpa-host-launch","serve","/models/Qwen2.5-7B-Instruct","--served-model-name","ecpa-h1","--host","127.0.0.1","--port","8187","--tensor-parallel-size","2","--enforce-eager","--max-model-len","2048","--gpu-memory-utilization","0.7","--shutdown-timeout","20","--disable-ecpa-manager","--enable-entrypoints"],"digest":"sha256:32df134f048bb4c192be8729c43a85d262c45a0830ea445e1a9b3171d0cf5e5f","executable":"/root/ecpa-h1-e583-stock-venv/bin/python","executable_device":2097167,"executable_inode":77098091,"executable_resolved":"/usr/local/python3.12.13/bin/python3.12","executable_sha256":"sha256:5d137e6378d886d6ee0390e126011e9e8af81290032e3fefa13a81f72651fda0"}},"lifecycle_fact_commands":{"fault-injected":{"argument_files":[{"index":0,"path":"/root/ecpa-h1-e583-stock-venv/bin/ecpa-formal-source","sha256":"sha256:4005857511b02d4b27abb5442ef0bd711c4ffc1dafb1e602b1e3504ab16d0298"},{"index":15,"path":"/root/ecpa-h1-e583-registration-workspace/inputs/h1-partial-worker-coverage-fault.json","sha256":"sha256:83cf593eda175a7a8c809350a6456bb1070bcba25e3b341c9c6598db16d46a17"}],"arguments":["/root/ecpa-h1-e583-stock-venv/bin/ecpa-formal-source","partial-coverage-quarantine","--event-dir","/root/ecpa-h1-e583-registration-workspace/shared/events","--device","2128","--inode","14811151","--quarantine-dir","/root/ecpa-h1-e583-registration-workspace/shared/quarantine","--quarantine-device","2128","--quarantine-inode","14811152","--descriptor","/root/ecpa-h1-e583-registration-workspace/inputs/h1-partial-worker-coverage-fault.json","--descriptor-sha256","sha256:83cf593eda175a7a8c809350a6456bb1070bcba25e3b341c9c6598db16d46a17"],"digest":"sha256:35d7ec5ccab938f85d5a8b9c5302f77cfc02a9365a29fab64fda074daa3e53f9","executable":"/root/ecpa-h1-e583-stock-venv/bin/python","executable_device":2097167,"executable_inode":77098091,"executable_resolved":"/usr/local/python3.12.13/bin/python3.12","executable_sha256":"sha256:5d137e6378d886d6ee0390e126011e9e8af81290032e3fefa13a81f72651fda0"},"observer-captured":{"argument_files":[{"index":0,"path":"/root/ecpa-h1-e583-stock-venv/bin/ecpa-formal-source","sha256":"sha256:4005857511b02d4b27abb5442ef0bd711c4ffc1dafb1e602b1e3504ab16d0298"}],"arguments":["/root/ecpa-h1-e583-stock-venv/bin/ecpa-formal-source","journal-capture","--event-dir","/root/ecpa-h1-e583-registration-workspace/shared/events","--device","2128","--inode","14811151"],"digest":"sha256:5b1b6504ff6a79833beb9e704990b592ebd7739e3e63cf5d2f1ceb4bfec9ca1a","executable":"/root/ecpa-h1-e583-stock-venv/bin/python","executable_device":2097167,"executable_inode":77098091,"executable_resolved":"/usr/local/python3.12.13/bin/python3.12","executable_sha256":"sha256:5d137e6378d886d6ee0390e126011e9e8af81290032e3fefa13a81f72651fda0"},"service-ready":{"argument_files":[{"index":0,"path":"/root/ecpa-h1-e583-stock-venv/bin/ecpa-formal-source","sha256":"sha256:4005857511b02d4b27abb5442ef0bd711c4ffc1dafb1e602b1e3504ab16d0298"}],"arguments":["/root/ecpa-h1-e583-stock-venv/bin/ecpa-formal-source","readiness-http","--url","http://127.0.0.1:8187/health","--status","200","--timeout","2","--startup-timeout","600","--poll-interval","1"],"digest":"sha256:70a70654a889bfb4d65013b98b254adeaab8df991a051efc616c66bbd76fa634","executable":"/root/ecpa-h1-e583-stock-venv/bin/python","executable_device":2097167,"executable_inode":77098091,"executable_resolved":"/usr/local/python3.12.13/bin/python3.12","executable_sha256":"sha256:5d137e6378d886d6ee0390e126011e9e8af81290032e3fefa13a81f72651fda0"},"service-shutdown":{"argument_files":[{"index":0,"path":"/root/ecpa-h1-e583-stock-venv/bin/ecpa-formal-source","sha256":"sha256:4005857511b02d4b27abb5442ef0bd711c4ffc1dafb1e602b1e3504ab16d0298"}],"arguments":["/root/ecpa-h1-e583-stock-venv/bin/ecpa-formal-source","shutdown-process","--timeout","45"],"digest":"sha256:b4bb22e29750ee65d7d7845b2313f3237d7f56ff5ade5b7b73324c11532cb9c5","executable":"/root/ecpa-h1-e583-stock-venv/bin/python","executable_device":2097167,"executable_inode":77098091,"executable_resolved":"/usr/local/python3.12.13/bin/python3.12","executable_sha256":"sha256:5d137e6378d886d6ee0390e126011e9e8af81290032e3fefa13a81f72651fda0"},"workload-complete":{"argument_files":[{"index":0,"path":"/root/ecpa-h1-e583-stock-venv/bin/ecpa-formal-source","sha256":"sha256:4005857511b02d4b27abb5442ef0bd711c4ffc1dafb1e602b1e3504ab16d0298"},{"index":5,"path":"/root/ecpa-h1-e583-registration-workspace/inputs/h1-qwen2.5-7b-workload.json","sha256":"sha256:9ff24793404386289eb61866b57f6943914af8f46317af28dc60c279e777198d"}],"arguments":["/root/ecpa-h1-e583-stock-venv/bin/ecpa-formal-source","workload-http","--url","http://127.0.0.1:8187/v1/completions","--request","/root/ecpa-h1-e583-registration-workspace/inputs/h1-qwen2.5-7b-workload.json","--request-sha256","sha256:9ff24793404386289eb61866b57f6943914af8f46317af28dc60c279e777198d","--timeout","60"],"digest":"sha256:dd39362e3fc44df6432a09920eb20db06a76fc45948f8fa8d8b4084442ea0f0f","executable":"/root/ecpa-h1-e583-stock-venv/bin/python","executable_device":2097167,"executable_inode":77098091,"executable_resolved":"/usr/local/python3.12.13/bin/python3.12","executable_sha256":"sha256:5d137e6378d886d6ee0390e126011e9e8af81290032e3fefa13a81f72651fda0"}},"port":8187,"registry_candidate":{"activation_contract":"entry-points-unmanaged","activation_probe":{"command_digest":"sha256:9cc09fe8c736a8081a3b1e4b0346a8c2b2d36e91acb55cc47e9b63970a102678","required_options":["--disable-ecpa-manager","--enable-entrypoints"],"timeout_s":30},"admission":null,"arm":"vanilla-vllm-entry-points","evidence_channel":"host-owned-event-stream","evidence_owner":"vllm-hust-host","host_event_schema":"ecpa-host-runtime-evidence/v1","id":"h1-910b2-tp2-vanilla-candidate-v1","lifecycle_fact_command_digests":{"fault-injected":"sha256:35d7ec5ccab938f85d5a8b9c5302f77cfc02a9365a29fab64fda074daa3e53f9","observer-captured":"sha256:5b1b6504ff6a79833beb9e704990b592ebd7739e3e63cf5d2f1ceb4bfec9ca1a","service-ready":"sha256:70a70654a889bfb4d65013b98b254adeaab8df991a051efc616c66bbd76fa634","service-shutdown":"sha256:b4bb22e29750ee65d7d7845b2313f3237d7f56ff5ade5b7b73324c11532cb9c5","workload-complete":"sha256:dd39362e3fc44df6432a09920eb20db06a76fc45948f8fa8d8b4084442ea0f0f"},"lifecycle_fact_schema":"ecpa-formal-lifecycle-fact/v1","lifecycle_fact_schema_digest":"sha